{
  "dataset_name": "ligand_unbinding_demo_from_cli",
  "version": "0.1.0",
  "task": {
    "task_type": "future_event_prediction",
    "target_event": "ligand_unbinding",
    "input_type": "trajectory_window",
    "label_type": "binary_event_within_horizon",
    "extensions": {
      "label_source": "rule_based",
      "event_definition": {
        "name": "ligand_unbinding",
        "type": "feature_threshold",
        "feature": "ligand_pocket_min_distance",
        "operator": "greater_than",
        "threshold": 6.0,
        "horizon_frames": 2
      }
    },
    "horizon_frames": 2
  },
  "system": {
    "system_type": "protein_ligand",
    "protein": "unknown",
    "ligand": "present"
  },
  "storage_profile": "compressed",
  "coordinate_storage": {
    "included": true,
    "external": false,
    "format": "zarr",
    "notes": "Coordinates are embedded in the downloadable MDDataNet package."
  },
  "splits": {
    "policy": "temporal_split",
    "train": 3,
    "validation": 1,
    "test": 1,
    "notes": "Generated by mddatanet split using strategy=temporal."
  },
  "statistics": {
    "num_trajectories": 1,
    "total_frames": 5,
    "num_runs": 1,
    "num_atoms": 5,
    "num_residues": 2
  },
  "license": "unknown",
  "provenance": {
    "source_files": [
      {
        "path": "outputs/_ligand_unbinding_demo_work/ligand_unbinding_demo.pdb",
        "sha256": "c5caeb9511ca8487cf761a7a7d7199c5ff62066d749de05310a78434fd6f58ea",
        "role": "topology",
        "size_bytes": 2089,
        "format": "pdb",
        "resolved_path": "/Users/leonchien/Projects/mddn-cli/outputs/_ligand_unbinding_demo_work/ligand_unbinding_demo.pdb"
      }
    ],
    "runs": [
      {
        "run_id": "run_0",
        "trajectory_format": "pdb",
        "reader": "PDBReader",
        "atom_count": 5,
        "num_frames": 5,
        "package_start": 0,
        "package_stop": 5,
        "source_start": 0,
        "source_stop": 5,
        "source_stride": 1,
        "timestep_ps": 1.0,
        "time_unit": "ps",
        "has_periodic_box": false
      }
    ],
    "commands": [
      "mddatanet demo ligand_unbinding",
      "mddatanet demo ligand_unbinding"
    ]
  },
  "extensions": {
    "source_metadata_path": "metadata.json",
    "source_dataset_name": "ligand_unbinding_demo",
    "source_description": "Synthetic runtime demo labeled for ligand unbinding.",
    "mddatanet_version": "0.1.0",
    "feature_names": [
      "ligand_pocket_min_distance"
    ],
    "event_names": [
      "ligand_unbinding"
    ],
    "label_statistics": {
      "ligand_unbinding": {
        "event_now_positive_rate": 0.4,
        "valid_future_positive_rate": 0.6666666666666666,
        "valid_future_frame_count": 3,
        "horizon_frames": 2
      }
    }
  }
}
