{
  "dataset_name": "ligand_unbinding_demo",
  "version": "0.1.0",
  "task": {
    "task_type": "future_event_prediction",
    "target_event": "ligand_unbinding",
    "horizon_frames": 500,
    "input_type": "trajectory_window",
    "label_type": "binary_event_within_horizon",
    "extensions": {
      "example_event_rule": "ligand-protein contact distance exceeds an illustrative unbinding threshold"
    }
  },
  "system": {
    "system_type": "protein_ligand",
    "protein": "demo kinase-like receptor",
    "ligand": "demo small molecule"
  },
  "storage_profile": "metadata_only",
  "coordinate_storage": {
    "included": false,
    "external": true,
    "format": "mddatanet_zip",
    "notes": "Demo entry only; URLs are placeholders and not production assets."
  },
  "splits": {
    "policy": "trajectory_split",
    "train": 8,
    "validation": 1,
    "test": 1,
    "notes": "Illustrative trajectory-level split."
  },
  "statistics": {
    "num_trajectories": 10,
    "total_frames": 500000
  },
  "license": "CC-BY-4.0",
  "citation": "See citation.bib",
  "provenance": {
    "source": "Demo metadata created for MDDataNet Hub scaffolding.",
    "md_engine": "not_applicable_demo"
  },
  "extensions": {
    "production_status": "demo_only"
  }
}
